[
  {
    "application_rules": [
      "Treat mode, pool, and module selection as Python control-plane decisions before donor orchestration begins.",
      "Route coding_model packets to Claw through the agent-platform adapter; route non-coding orchestration to merged OMA.",
      "Pass selected refs and compact summaries to executors, not mutable orchestration policy."
    ],
    "label": "Artifact-First Task Graph Execution",
    "module_refs": [
      "artifact://module-card/engineering_orchestration_stack"
    ],
    "schema_version": "1.0.0",
    "summary": "Apply explicit task packets, selected refs, and shared result digests without direct agent-to-agent messaging.",
    "technique_card_id": "artifact_first_task_graph_execution",
    "technique_key": "artifact_first_task_graph_execution",
    "theory_refs": [
      "artifact://theory-card/computational_engineering_numerical_methods"
    ],
    "verification_rules": [
      "Confirm task packets include response_control_ref and selected pool/module/technique/theory refs.",
      "Confirm routing_metadata.selected_executor remains stable and explicit.",
      "Confirm Claw receives translated execution context only."
    ]
  },
  {
    "application_rules": [
      "Define flow regime, boundary conditions, discretization, and turbulence/transport assumptions up front.",
      "Track conservation quantities and residual targets as acceptance criteria.",
      "Keep mesh/domain sensitivity visible when results drive engineering decisions."
    ],
    "label": "CFD Conservation Verification",
    "module_refs": [
      "artifact://module-card/cfd_solver_stack"
    ],
    "schema_version": "1.0.0",
    "summary": "Apply CFD modules with explicit transport assumptions, boundary discipline, and conservation checks.",
    "technique_card_id": "cfd_conservation_verification",
    "technique_key": "cfd_conservation_verification",
    "theory_refs": [
      "artifact://theory-card/computational_engineering_numerical_methods"
    ],
    "verification_rules": [
      "Check mass, momentum, energy, or species balances against the stated model.",
      "Verify residuals and monitored quantities stabilize together.",
      "Compare against a benchmark or simplified reference flow when available."
    ]
  },
  {
    "application_rules": [
      "State species set, mechanism scope, thermodynamic basis, and reaction assumptions before execution.",
      "Separate chemical-domain assumptions from numerical-solver choices.",
      "Keep units, temperature/pressure ranges, and source provenance visible."
    ],
    "label": "Chemical Model Verification",
    "module_refs": [
      "artifact://module-card/chemical_modeling_stack"
    ],
    "schema_version": "1.0.0",
    "summary": "Apply chemical modeling modules with species, mechanisms, thermochemistry, and kinetic assumptions kept explicit.",
    "technique_card_id": "chemical_model_verification",
    "technique_key": "chemical_model_verification",
    "theory_refs": [
      "artifact://theory-card/chemistry_chemical_modeling_basis"
    ],
    "verification_rules": [
      "Check elemental balance and reaction stoichiometry before accepting mechanism output.",
      "Compare calculated properties or rates against static reference points when available.",
      "Flag extrapolation beyond source data or model validity ranges."
    ]
  },
  {
    "application_rules": [
      "State load paths, boundary conditions, material assumptions, and simplifications before model execution.",
      "Keep geometry preparation separate from solver setup when manufacturing constraints are active.",
      "Select elements and discretization according to the expected field behavior."
    ],
    "label": "FEM Model Verification",
    "module_refs": [
      "artifact://module-card/fem_solver_stack"
    ],
    "schema_version": "1.0.0",
    "summary": "Apply finite-element modules with explicit boundary conditions, mesh convergence, and reference-case checks.",
    "technique_card_id": "fem_model_verification",
    "technique_key": "fem_model_verification",
    "theory_refs": [
      "artifact://theory-card/mechanical_engineering_mechanics_basis",
      "artifact://theory-card/computational_engineering_numerical_methods"
    ],
    "verification_rules": [
      "Require mesh convergence or sensitivity evidence for governed conclusions.",
      "Compare against a closed-form, benchmark, or simplified static reference where possible.",
      "Flag singular constraints, unconstrained rigid-body motion, and nonphysical stress concentrations."
    ]
  },
  {
    "application_rules": [
      "Preserve design intent, tolerances, datum assumptions, and manufacturing exclusions.",
      "Separate construction geometry from exported manufacturing or simulation geometry.",
      "Attach inspection and downstream mesh requirements to the handoff artifact."
    ],
    "label": "Geometry-to-Manufacturing Handoff",
    "module_refs": [
      "artifact://module-card/manufacturing_geometry_stack"
    ],
    "schema_version": "1.0.0",
    "summary": "Translate CAD/geometry modules into manufacturable, inspectable, and simulation-ready artifacts.",
    "technique_card_id": "geometry_to_manufacturing_handoff",
    "technique_key": "geometry_to_manufacturing_handoff",
    "theory_refs": [
      "artifact://theory-card/manufacturing_process_basis"
    ],
    "verification_rules": [
      "Check exported geometry for watertightness, units, feature naming, and tolerance-critical surfaces.",
      "Confirm the manufacturing process can realize the selected features and tolerances.",
      "Validate meshability or downstream solver compatibility before using geometry in simulation."
    ]
  },
  {
    "application_rules": [
      "Identify governing equations, variable scales, constraints, and likely stiffness before selecting an algorithm.",
      "Prefer bounded, schema-governed runtime calls when execution artifacts must be reproducible.",
      "Keep units and tolerances explicit in task packets and verification criteria."
    ],
    "label": "Numerical Solver Selection",
    "module_refs": [
      "artifact://module-card/numerical_solver_stack"
    ],
    "schema_version": "1.0.0",
    "summary": "Choose numerical solvers by equation class, stiffness, constraints, sensitivity, units, and validation anchors.",
    "technique_card_id": "numerical_solver_selection",
    "technique_key": "numerical_solver_selection",
    "theory_refs": [
      "artifact://theory-card/computational_engineering_numerical_methods"
    ],
    "verification_rules": [
      "Check conservation, residual, or objective convergence against an isolated reference case.",
      "Run a dimensional sanity check before accepting numerical output.",
      "Record solver assumptions and failure signatures in the produced artifact."
    ]
  },
  {
    "application_rules": [
      "Identify the governing standard, revision, jurisdiction, and applicability limits.",
      "Separate mandatory requirements from reference guidance or benchmark data.",
      "Attach unit policy and source refs to the verification artifact."
    ],
    "label": "Standards-Anchored Verification",
    "module_refs": [
      "artifact://module-card/standards_reference_bank"
    ],
    "schema_version": "1.0.0",
    "summary": "Use standards and static references as verification anchors without letting them become hidden assumptions.",
    "technique_card_id": "standards_anchored_verification",
    "technique_key": "standards_anchored_verification",
    "theory_refs": [
      "artifact://theory-card/standards_data_interpretation_basis"
    ],
    "verification_rules": [
      "Confirm source applicability before using a standard as an acceptance gate.",
      "Validate unit conversions and table lookups against source reference points.",
      "Record conflicts or stale references as explicit open issues."
    ]
  }
]
